{
  "intent_id": "urn:oap:intent:demo-delegation-1",
  "issuer_did": "did:web:agent.example",
  "category": "delegation",
  "constraints": {
    "all_of": [
      { "path": "/capabilities", "operator": "contains", "value": "contract_review" },
      { "path": "/jurisdictions", "operator": "contains", "value": "DE" },
      { "path": "/availability/next_slot_within_minutes", "operator": "lte", "value": 240 }
    ]
  },
  "projection": {
    "include": ["/agent_did", "/capabilities", "/availability", "/cost"],
    "exclude": ["/internal_routing"]
  },
  "budget": {
    "amount": "500.00",
    "currency": "EUR",
    "allocation": "single_winner"
  },
  "quality_floor": {
    "conformance_level": "L2",
    "performance_score": 0.85
  },
  "validity": { "from": "2026-05-04T00:00:00Z", "to": "2026-05-11T00:00:00Z" },
  "resolution_policy": "single_best",
  "signature": { "alg": "EdDSA", "value": "demo-signature" }
}
